experiment_id,experiment_name,short_name,status,machine,data_asset,source_domain,target_domain,manifest,train_task,train_mask_mode,mask_from_manifest,mask_area_range,prior_mode,loss_region_mode,beta_dpo,lose_gap_weight,winner_abs_reg_weight,winner_gap_reg_weight,winner_gap_reg_margin,sft_reg_weight,stage1_run_dir,stage2_run_dir,dpo_diag_csv,qual_dir,metric_dir,vbench_dir,conclusion,next_action
exp01,DiffuEraser reproduction / SFT / metric setting,diffueraser_reproduction_sft,historical_complete_registry_partial,HAL/H20/PAI historical,DiffuEraser official/SFT assets,DAVIS/YouTube-VOS-style inpainting,video inpainting,historical; see PRD/DPO_Project_Complete_Summary.md,DiffuEraser SFT/reproduction,partial/full depending eval,n/a,n/a,propainter for partial-mask inpainting; no-prior/noise for fullmask generation,SFT reconstruction,,,,,,SFT MSE,historical path backfill needed,historical path backfill needed,not DPO,historical qualitative path backfill needed,historical metrics path backfill needed,n/a for inpainting,"SFT-48000 is a strong YouTube-VOS-tuned baseline, not a naked base.",Keep as baseline reference; do not call converted_weights_step48000 ordinary base.
exp02,official VideoDPO / VC2 reproduction,official_videodpo_vc2,historical_complete_registry_partial_missing_diag,PAI/H20 historical,official VideoDPO pairs,VideoDPO,video generation preference reproduction,official VideoDPO manifest; path backfill needed,official VideoDPO VC2,full/video-generation,false,n/a,no ProPainter prior; generation task,official full-video,official/default,official/default,0,0,0,official/default,path backfill needed,path backfill needed,MISSING_DPO_DIAG,path backfill needed,path backfill needed,path backfill needed,Official pipeline sanity check.,Backfill artifacts if needed for provenance.
exp03,official VideoDPO framework with DiffuEraser replacement,official_videodpo_diffueraser,historical_complete_registry_partial_missing_diag,PAI/H20 historical,official VideoDPO pairs with DiffuEraser model bridge,VideoDPO,bridge sanity check,official VideoDPO manifest; path backfill needed,full-mask bridge / video-generation style,full,false,n/a,no ProPainter prior; fullmask bridge,full-video,historical/default,historical/default,0,0,0,historical/default,path backfill needed,path backfill needed,MISSING_DPO_DIAG,path backfill needed,path backfill needed,path backfill needed,DiffuEraser can be wired into VideoDPO; later failures are objective/data issues.,Backfill artifacts if needed.
exp04,Exp4 fullmask generated loser quality gate,fullmask_loser_failed_gate,failed_quality_gate_deleted_artifact,HAL evidence; PAI/H20 path missing,fullmask DiffuEraser generated losers from VideoDPO winners,VideoDPO,fullmask generated-loser diagnostic,not found; exp4-data reportedly deleted,planned data-only full-mask bridge; no official useful training,full,false,full frame,no-prior/noise; fullmask has no context,full-video,planned old default likely 500,planned 1.0,0,0,0,0,n/a,n/a,not applicable; failed before useful DPO,/home/hj/dpo-2-1-exp/exp4-data (deleted/missing),n/a,n/a,Generated fullmask losers were too poor; stopped as data negative evidence.,Do not continue Exp4; explain why partial-mask K=4 was introduced.
exp05_old,Old Exp5 D2 comp plain DPO beta500,old_d2_comp_plain_failed,failed_collapse_remote_diag_found,PAI remote artifacts,D2 partial-mask comp K=4 generated losers,VideoDPO,data-only bridge diagnostic,D2 selected_primary_comp.repaired.jsonl; exact PAI path pending,data-only full-mask bridge; model did not see partial mask,full,false,old D2 policy roughly 20-30% or larger; audit pending,no ProPainter prior for fullmask bridge,full-video,500,1.0,0,0,0,0,/mnt/nas/hj/H20_Video_inpainting_DPO/experiments/dpo/stage1/20260526_172044_exp5_d2_comp_k4_stage1_full,/mnt/nas/hj/H20_Video_inpainting_DPO/experiments/dpo/stage2/20260527_181634_exp5_d2_comp_k4_stage2_full,/mnt/nas/hj/H20_Video_inpainting_DPO/experiments/dpo/stage1/20260526_172044_exp5_d2_comp_k4_stage1_full/dpo_diagnostics.csv;/mnt/nas/hj/H20_Video_inpainting_DPO/experiments/dpo/stage2/20260527_181634_exp5_d2_comp_k4_stage2_full/dpo_diagnostics.csv,/home/hj/dpo-2-1-exp/exp5; PAI qual path pending,PAI/H20 path pending,/mnt/nas/hj/H20_Video_inpainting_DPO/logs/vbench_exp5/...,Collapsed: ranking can be satisfied while winner visual quality breaks.,Keep as failed DPO evidence; fetch remote dpo CSV if numeric tables are needed.
exp05_beta10,Exp5 beta10 plain D2 comp DPO,beta10_plain_failed,failed_collapse_remote_diag_found,PAI remote artifacts,D2 partial-mask comp K=4 generated losers,VideoDPO,beta-pressure diagnostic,D2 selected_primary_comp.repaired.jsonl; exact PAI path pending,data-only full-mask bridge; model did not see partial mask,full,false,old D2 policy roughly 20-30% or larger; audit pending,no ProPainter prior for fullmask bridge,full-video,10,1.0,0,0,0,0,/mnt/nas/hj/H20_Video_inpainting_DPO/experiments/dpo/stage1/20260530_134935_exp5_d2_comp_k4_beta10_s1s2_4000_stage1_beta10_4000,/mnt/nas/hj/H20_Video_inpainting_DPO/experiments/dpo/stage2/20260530_134935_exp5_d2_comp_k4_beta10_s1s2_4000_stage2_beta10_4000,/mnt/nas/hj/H20_Video_inpainting_DPO/experiments/dpo/stage1/20260530_134935_exp5_d2_comp_k4_beta10_s1s2_4000_stage1_beta10_4000/dpo_diagnostics.csv;/mnt/nas/hj/H20_Video_inpainting_DPO/experiments/dpo/stage2/20260530_134935_exp5_d2_comp_k4_beta10_s1s2_4000_stage2_beta10_4000/dpo_diagnostics.csv,/mnt/nas/hj/H20_Video_inpainting_DPO/logs/qual_sbs_30/exp5_d2_comp_k4_beta10_s1s2_4000_20260530_134935,PAI/H20 path pending,PAI/H20 path pending,Lower beta alone did not solve collapse; missing winner preservation was the core issue.,Use as bridge from Old Exp5 to New Exp5 winner-anchor.
exp05_new,New Exp5 D2 comp winner-gap regularized DPO,new_d2_comp_wingap_lose025,completed_improved_remote_diag_found_not_final,PAI remote artifacts,D2 partial-mask comp K=4 generated losers,VideoDPO,data-only bridge diagnostic,D2 selected_primary_comp.repaired.jsonl; exact PAI path pending,data-only full-mask bridge; model did not see partial mask,full,false,old D2 policy roughly 20-30% or larger; audit pending,no ProPainter prior for fullmask bridge,full-video,10,0.25,0.05,1.0,0.0,0,/mnt/nas/hj/H20_Video_inpainting_DPO/experiments/dpo/stage1/20260531_134817_exp5_d2_comp_k4_wingap_lose025_beta10_s1s2_4000_stage1,/mnt/nas/hj/H20_Video_inpainting_DPO/experiments/dpo/stage2/20260531_134817_exp5_d2_comp_k4_wingap_lose025_beta10_s1s2_4000_stage2,/mnt/nas/hj/H20_Video_inpainting_DPO/experiments/dpo/stage1/20260531_134817_exp5_d2_comp_k4_wingap_lose025_beta10_s1s2_4000_stage1/dpo_diagnostics.csv;/mnt/nas/hj/H20_Video_inpainting_DPO/experiments/dpo/stage2/20260531_134817_exp5_d2_comp_k4_wingap_lose025_beta10_s1s2_4000_stage2/dpo_diagnostics.csv,/mnt/nas/hj/H20_Video_inpainting_DPO/logs/qual_sbs_30/exp5_d2_comp_k4_wingap_lose025_beta10_s1s2_4000_20260531_134817; /home/hj/dpo-2-1-exp/new-exp5,PAI/H20 path pending,PAI/H20 path pending,Winner anchoring improved visual quality relative to Old Exp5 collapse but did not solve task mismatch.,Use as guardrail evidence; do not call final success.
exp06_new,New Exp6 D2 no-comp winner-gap regularized DPO,new_d2_nocomp_wingap_lose025,completed_h20_diag_local,H20,D2 partial-mask no-comp K=4 raw generated losers,VideoDPO,comp/no-comp diagnostic,/mnt/nas/hj/H20_Video_inpainting_DPO/data/generated_losers/official_videodpo_diffueraser_data_partialmask_loser_k4/manifests/selected_primary_nocomp.repaired.jsonl,data-only full-mask bridge; model did not see partial mask,full,false,old D2 policy roughly 20-30% or larger; audit pending,no ProPainter prior for fullmask bridge,full-video,10,0.25,0.05,1.0,0.0,0,/home/nvme01/H20_Video_inpainting_DPO/experiments/dpo/stage1/20260601_004753_exp6_d2_nocomp_k4_wingap_lose025_beta10_s1s2_4000_stage1,/home/nvme01/H20_Video_inpainting_DPO/experiments/dpo/stage2/20260601_004753_exp6_d2_nocomp_k4_wingap_lose025_beta10_s1s2_4000_stage2,reports/dpo_diag_snapshots/exp06_new_stage1_dpo_diagnostics.csv;reports/dpo_diag_snapshots/exp06_new_stage2_dpo_diagnostics.csv,/home/hj/dpo-2-1-exp/new-exp6; /home/nvme01/H20_Video_inpainting_DPO/logs/qual_sbs_30/exp6_d2_nocomp_k4_wingap_lose025_beta10_s1s2_4000_20260601_004753,H20 qual_sbs and prompt-length reports,path backfill pending,"New Exp6 is no-comp + winner anchoring, not plain Exp6; promising qualitative progress but not final.",Use for comp/no-comp story; do not rename as plain Exp6.
exp07_current,Exp7 current D2 partial-mask task gate,partialmask_task_current_failed,failed_or_suspicious_remote_diag_found,PAI/H20 NAS; HAL visual evidence,D2 comp manifest with generated partial masks,VideoDPO clips mostly static,partial-mask inpainting task alignment,/mnt/nas/hj/H20_Video_inpainting_DPO/data/generated_losers/official_videodpo_diffueraser_data_partialmask_loser_k4/manifests/selected_primary_comp.repaired.jsonl,true partial-mask inpainting,partial,true,old D2 policy; likely too large for current goal; audit pending,training uses manifest masks; eval tool currently appears no ProPainter prior,full,10,0.25,0.05,1.0,0.0,0,/mnt/nas/hj/H20_Video_inpainting_DPO/experiments/dpo/stage1/20260601_065618_exp7_d2_comp_k4_partial_wingap_lose025_beta10_s1s2_gate1500_stage1,/mnt/nas/hj/H20_Video_inpainting_DPO/experiments/dpo/stage2/20260601_065618_exp7_d2_comp_k4_partial_wingap_lose025_beta10_s1s2_gate1500_stage2,/mnt/nas/hj/H20_Video_inpainting_DPO/experiments/dpo/stage1/20260601_065618_exp7_d2_comp_k4_partial_wingap_lose025_beta10_s1s2_gate1500_stage1/dpo_diagnostics.csv;/mnt/nas/hj/H20_Video_inpainting_DPO/experiments/dpo/stage2/20260601_065618_exp7_d2_comp_k4_partial_wingap_lose025_beta10_s1s2_gate1500_stage2/dpo_diagnostics.csv,/home/hj/dpo-2-1-exp/exp7-gate1500; /mnt/nas/hj/H20_Video_inpainting_DPO/logs/qual_sbs_30/exp7_d2_comp_k4_partial_wingap_lose025_beta10_s1s2_gate1500_20260601_065618,/mnt/nas/hj/H20_Video_inpainting_DPO/logs/partialmask_eval/exp7_gate1500_20260601_131656/metrics; exp7_gate1500_20260602_000500/metrics,not used,"Task changed but quality is unstable; base also poor, so eval/prior/domain/mask must be audited before more DPO.",Run Exp7 small-mask + ProPainter-prior fix gate only after data check.
exp07_fix,Exp7 fix: VideoDPO small-mask 15-20 + ProPainter prior,fix_smallmask_prior,data_generation_running_h20,H20 launch candidate; PAI manual later,new non-overwriting VideoDPO small-mask generated losers,VideoDPO clips mostly static,partial-mask inpainting sanity before D3,data/generated_losers/exp07_fix_videodpo_smallmask15_20_prior_k4/manifests/selected_primary_comp.repaired.jsonl,Stage1-only partial-mask inpainting gate,partial,true,0.15-0.20,propainter required for partial-mask generation/eval,full,10,0.25 PAI/H20 main; 0.0 optional no-lose,0.05,1.0,0.0,0,pending; data generation running first,none; DPO Stage2 disabled,MISSING_DPO_DIAG,pending four-column visualization,pending inference/metrics.py true partial-mask eval,not used,Planned correction for Exp7 before expanding D3.,Monitor data generation; launch Stage1 only after selected_primary_comp manifest exists.
exp07_hybrid,Exp7 DPO-S1 + frozen SFT/base-S2 hybrid,dpoS1_sftS2_hybrid,eval_complete_negative,PAI/H20 NAS,D2 partial-mask eval,VideoDPO,stage composition diagnostic,same D2 selected_primary_comp.repaired.jsonl,no training; hybrid checkpoint build/eval,partial inference,true,old D2 policy,eval tool appears no ProPainter prior,n/a,,,,,,,Exp7 DPO Stage1 last_weights from D2 partial-mask comp gate,official/base/SFT Stage2 temporal weights,not training; see Exp7 diag,/home/hj/dpo-2-1-exp/Hybrid_DPO_S1_last__Official_DiffuEraser_base_Stage2,/mnt/nas/hj/H20_Video_inpainting_DPO/logs/partialmask_eval/exp7_pm_dpoS1_sftS2_hybrid_20260602_025336/metrics,not used,Did not rescue Exp7; confirms Stage2 DPO should remain stopped.,Do not treat as final candidate.
exp08,Exp8 D3 comp region-loss diagnostic,regionloss_diagnostic,PAI_gate_remote_diag_found_eval_pending,PAI remote artifacts,D3 YouTube-VOS comp generated losers,YouTube-VOS train,DAVIS eval later,/mnt/workspace/hj/nas_hj/H20_Video_inpainting_DPO/data/generated_losers/official_videodpo_diffueraser_youtubevos_partialmask_loser_k4/manifests/selected_primary_comp.repaired.pai_paths.jsonl,Stage1-only partial-mask inpainting,partial,true,D3 existing policy; not VideoDPO fix,must use SFT-48000 weights for YouTube-VOS; prior audit pending,region,10,0.25,0.05,1.0,0.0,0,/mnt/nas/hj/H20_Video_inpainting_DPO/experiments/dpo/stage1/20260526_172044_exp8_youtubevos_d3_comp_regionloss_wingap_lose025_stage1_gate1500_stage1,none,/mnt/nas/hj/H20_Video_inpainting_DPO/experiments/dpo/stage1/20260526_172044_exp8_youtubevos_d3_comp_regionloss_wingap_lose025_stage1_gate1500_stage1/dpo_diagnostics.csv,pending,pending,not used,Region-loss diagnostic is valid only if implementation and SFT-48000 baseline are confirmed.,Do not expand D3 until Exp7 smallmask/prior sanity is fixed.
exp08a,Exp8a D3 comp full-loss DAVIS Stage1+Stage2 2000,d3_comp_fullloss_davis_s1s2_2000,completed_negative_davis_metrics_and_diag_present,PAI manual/user pasted audit,D3 YouTube-VOS comp generated losers,YouTube-VOS train,DAVIS partial-mask validation,/mnt/workspace/hj/nas_hj/H20_Video_inpainting_DPO/data/generated_losers/official_videodpo_diffueraser_youtubevos_partialmask_loser_k4/manifests/selected_primary_comp.repaired.pai_paths.jsonl,Stage1 2000 then Stage1 DAVIS val then Stage2 2000 then Stage2 DAVIS val,partial,true,D3 existing target-domain masks,ProPainter prior required for DAVIS validation; SFT-48000 DiffuEraser required,full,10,0.25,0.05,1.0,0.0,0,/mnt/nas/hj/H20_Video_inpainting_DPO/experiments/dpo/stage1/20260605_142442_exp08_d3_comp_fullloss_wingap_lose025_s1_2000_davis_pai,/mnt/nas/hj/H20_Video_inpainting_DPO/experiments/dpo/stage2/20260606_070556_exp08_d3_comp_fullloss_wingap_lose025_s2_2000_davis_pai,/mnt/nas/hj/H20_Video_inpainting_DPO/experiments/dpo/stage1/20260605_142442_exp08_d3_comp_fullloss_wingap_lose025_s1_2000_davis_pai/dpo_diagnostics.csv;/mnt/nas/hj/H20_Video_inpainting_DPO/experiments/dpo/stage2/20260606_070556_exp08_d3_comp_fullloss_wingap_lose025_s2_2000_davis_pai/dpo_diagnostics.csv,/mnt/nas/hj/H20_Video_inpainting_DPO/logs/target_eval/exp08a_fullloss_stage1_val_davis_20260606_070556/inference;/mnt/nas/hj/H20_Video_inpainting_DPO/logs/target_eval/exp08a_fullloss_stage2_val_davis_20260606_070556/inference,/mnt/nas/hj/H20_Video_inpainting_DPO/logs/target_eval/exp08a_fullloss_stage1_val_davis_20260606_070556/metrics;/mnt/nas/hj/H20_Video_inpainting_DPO/logs/target_eval/exp08a_fullloss_stage2_val_davis_20260606_070556/metrics,not used,Completed negative baseline: Stage1 and Stage2 both underperform DiffuEraser-base on DAVIS and dpo_diag shows loser-degradation shortcut; not region-loss and not success.,Do not rerun Exp8a; use as negative full-loss baseline and keep Exp8b region-loss separate.
exp08c,Exp8c YouTube-VOS GT winner with D3 comp loser full-loss S1/S2 DAVIS,gtwin_d3_comp_fullloss_davis_s1s2_2000,h20_stage1_running_pai_launcher_tracked_ready,H20 active; PAI ready-to-launch from git-tracked code,H20 gtwin cache plus PAI generated cache via tools/prepare_exp8c_gtwin_manifest.py,YouTube-VOS train,DAVIS partial-mask validation,/home/nvme01/H20_Video_inpainting_DPO/data/generated_losers/exp08c_youtubevos_gtwin_d3comp_lose_fixed/manifests/selected_primary_comp.gtwin.jsonl; PAI /mnt/workspace/hj/nas_hj/H20_Video_inpainting_DPO/data/generated_losers/exp08c_youtubevos_gtwin_d3comp_lose_fixed_pai/manifests/selected_primary_comp.gtwin.pai_paths.jsonl,Stage1 2000 then Stage1 DAVIS val then Stage2 2000 then Stage2 DAVIS val,partial,true,D3 target-domain masks,ProPainter prior required for DAVIS validation; SFT-48000 DiffuEraser required,full,10,0.25,0.05,1.0,0.0,0,/home/nvme01/H20_Video_inpainting_DPO/experiments/dpo/stage1/20260606_114414_exp08c_youtubevos_gtwin_d3comp_fullloss_wingap_lose025_s1_2000_davis_h20,pending automatic Stage2 after Stage1 DAVIS validation; PAI launch pending,/home/nvme01/H20_Video_inpainting_DPO/experiments/dpo/stage1/20260606_114414_exp08c_youtubevos_gtwin_d3comp_fullloss_wingap_lose025_s1_2000_davis_h20/dpo_diagnostics.csv,pending DAVIS four-column validation,pending DAVIS inference metrics,not used,Running diagnostic only; H20 fp32/nosplit fixed SIGFPE and reached step 150; PAI bf16 launcher and GT-win manifest tool are now tracked in git; no final conclusion before DAVIS metrics and dpo summaries.,"Push HAL code, pull on H20, then launch PAI Exp8c from scripts/launch_exp8c_youtubevos_gtwin_d3comp_fullloss_s1s2_2000_davis_pai.sh; do not patch PAI terminal-only code."
exp09_comp,Exp9 D3 comp Stage1 target-domain gate,d3_comp_target_gate,PAI_clean_gate_complete_eval_complete_remote_diag_found,PAI remote artifacts,D3 YouTube-VOS comp generated losers,YouTube-VOS train,DAVIS eval required eventually,/mnt/workspace/hj/nas_hj/H20_Video_inpainting_DPO/data/generated_losers/official_videodpo_diffueraser_youtubevos_partialmask_loser_k4/manifests/selected_primary_comp.repaired.pai_paths.jsonl,Stage1-only partial-mask inpainting,partial,true,D3 existing policy,"must use fine-tuned DiffuEraser SFT-48000, not naked base; PAI path /mnt/workspace/hj/nas_hj/weights/diffuEraser/converted_weights_step48000",full,10,0.25,0.05,1.0,0.0,0,/mnt/nas/hj/H20_Video_inpainting_DPO/experiments/dpo/stage1/20260604_020643_exp9_youtubevos_d3_partialmask_wingap_lose025_stage1_gate1500_stage1,none,/mnt/nas/hj/H20_Video_inpainting_DPO/experiments/dpo/stage1/20260604_020643_exp9_youtubevos_d3_partialmask_wingap_lose025_stage1_gate1500_stage1/dpo_diagnostics.csv,/home/hj/dpo-2-1-exp/exp9_d3_comp_gate_pai_ckpt500; /mnt/nas/hj/H20_Video_inpainting_DPO/logs/target_eval/exp9_d3_comp_gate_pai_20260604_044925/side_by_side,/mnt/nas/hj/H20_Video_inpainting_DPO/logs/target_eval/exp9_d3_comp_gate_pai_20260604_044925/metrics,not used,ckpt500 is an early-window candidate; longer DPO degraded. Baseline/prior validity still needs care.,Do not scale D3 until Exp7 smallmask/prior audit passes.
exp09_nocomp,Exp9 D3 no-comp Stage1 target-domain gate,d3_nocomp_target_gate,H20_complete_eval_complete_local_diag,H20,D3 YouTube-VOS no-comp generated losers,YouTube-VOS train,DAVIS eval required eventually,/home/nvme01/H20_Video_inpainting_DPO/data/generated_losers/official_videodpo_diffueraser_youtubevos_partialmask_loser_k4/manifests/selected_primary_nocomp.jsonl,Stage1-only partial-mask inpainting,partial,true,D3 existing policy,must use SFT-48000 for YouTube-VOS; H20 confirmed path /home/nvme01/H20_Video_inpainting_DPO/weights/diffuEraser/converted_weights_step48000,full,10,0.25,0.05,1.0,0.0,0,/home/nvme01/H20_Video_inpainting_DPO/experiments/dpo/stage1/20260603_131758_exp9_youtubevos_d3_nocomp_partialmask_wingap_lose025_stage1_gate1500_h20_stage1,none,reports/dpo_diag_snapshots/exp09_nocomp_stage1_dpo_diagnostics.csv,/home/hj/dpo-2-1-exp/exp9_d3_nocomp_gate; H20 logs/target_eval/exp9_d3_nocomp_gate_h20_20260604_023243/side_by_side,/home/nvme01/H20_Video_inpainting_DPO/logs/target_eval/exp9_d3_nocomp_gate_h20_20260604_023243/metrics,not used,"Completed, but qualitative review says both baseline and DPO can look poor; use as caution.",Compare only after baseline/prior path audit.
exp09_nolose,Exp9 D3 comp no-lose-gap gate,d3_nolose_gate,H20_gate_complete_eval_pending_local_diag,H20,D3 YouTube-VOS comp generated losers,YouTube-VOS train,DAVIS eval required eventually,/home/nvme01/H20_Video_inpainting_DPO/data/generated_losers/official_videodpo_diffueraser_youtubevos_partialmask_loser_k4/manifests/selected_primary_comp.jsonl,Stage1-only partial-mask inpainting,partial,true,D3 existing policy,must use SFT-48000 for YouTube-VOS; H20 confirmed path /home/nvme01/H20_Video_inpainting_DPO/weights/diffuEraser/converted_weights_step48000,full,10,0.0,0.05,1.0,0.0,0,/home/nvme01/H20_Video_inpainting_DPO/experiments/dpo/stage1/20260604_080411_exp9_youtubevos_d3_comp_wingap_nolose_stage1_gate1000_h20_stage1,none,reports/dpo_diag_snapshots/exp09_comp_nolose_stage1_dpo_diagnostics.csv,pending,pending,not used,Tests removing loser-degradation incentive; do not evaluate as final until DAVIS/metric and prior baseline are fixed.,Hold D3 expansion until Exp7 fix.
exp08_s1s2,Exp8 D3 comp region-loss DAVIS Stage1+Stage2 2000,regionloss_davis_s1s2_2000,prepared_pai_manual_launch,PAI,D3 YouTube-VOS comp generated losers,YouTube-VOS train,DAVIS partial-mask validation,/mnt/workspace/hj/nas_hj/H20_Video_inpainting_DPO/data/generated_losers/official_videodpo_diffueraser_youtubevos_partialmask_loser_k4/manifests/selected_primary_comp.repaired.pai_paths.jsonl,Stage1 2000 then Stage1 DAVIS val then Stage2 2000 then Stage2 DAVIS val,partial,true,D3 existing policy,ProPainter prior required for DAVIS validation; SFT-48000 DiffuEraser required,region,10,0.25,0.05,1.0,0.0,0,pending,pending,pending Stage1 and Stage2 dpo_diagnostics.csv,pending logs/target_eval/exp08_stage*_val_davis_*/,pending logs/target_eval/exp08_stage*_val_davis_*/metrics,not used,Prepared diagnostic for region-weighted DPO with mask/boundary/outside weights and DAVIS validation.,Run only from PAI manual block after precheck passes; do not use VBench.
