milestone	status	notes
gpu_release	H20_EXP43_GPU_RELEASE_AUDITED	H20 GPU0-GPU7 have no compute apps; CUDA smoke passed; no PIDs/PGIDs killed.
readback	H20_EXP43_STAGE2_SFT_RUNNER_READBACK_COMPLETED	Exp41 blocker is existing runner step caps; Exp43 isolated runner authorized; H20 data/weights/protocol/BF16 state read back; Exp42 remains PAI-side data mining; VOR-Eval excluded.
bf16_preflight	H20_EXP43_BF16_SAFE_READY	P0-P7 passed on H20, including DDP8 bf16-safe one-batch train and rank0 checkpoint reload; no SIGFPE/OOM/CUDA/NaN/Inf/Xid; runtime-only, no quality claim.
data_readiness	H20_EXP43_DATA_READY	train64/search24/shadow24 built and validated; required path failures 0; scene overlap 0; VOR-Eval 0; hard comp 0; full train96/search32/shadow32 not available.
sft_a_30step	H20_EXP43_SFT_BLOCKED	SFT-A lr3e-5 trained 30 steps with 8GPU bf16-safe DDP; evaluation completed but search/shadow metrics were strongly negative; LPIPS runtime blocked; no 100/300/DPO/500 unlocked.
exp44_pseudosuccess_path_validation	H20_EXP43_EXP44_PSEUDOSUCCESS_PREFLIGHT_BLOCKED_MISSING_TARGETS	Exp44 pseudo-success train/search/shadow manifests have condition and mask paths present in H20 mirror, but pseudo-success target_frames_dir and target mp4 outputs are 0/40 present. No pseudo-success SFT, GT-only SFT, DPO, optimizer step, or model update launched.
